{
  "schemaVersion": "TransitionPlan 0.1",
  "domain": "project-state",
  "action": "schema-migration",
  "subject": {
    "kind": "project-state",
    "id": "mobilipresenter"
  },
  "authority": {
    "kind": "repository-file",
    "locator": {
      "path": "ops/state/project.json"
    }
  },
  "beforeStateHash": "d2faa23d0fd9e9b70c6b0bc14d7d4fa25e49e6d256ecaefb5f034c9e7b97773f",
  "afterStateHash": "ff06abb1d3f2cc06c6e56a66d3a5c1524ffb7069de44a0c8dfee59236248898f",
  "intent": {
    "fromSchemaVersion": "ProjectState 1.0",
    "toSchemaVersion": "ProjectState 2.0",
    "sourceControlHead": "031ce02039030078fdca3b40b282f1f789edca09",
    "sourceStateBlobSha": "1457b1265fd3b4c14a3f333bef4fc9bc2fb02c9f",
    "migrationMapPath": "ops/migrations/project-state-2.0.json",
    "migrationMapHash": "b7a628ab0c309057675f3e2cc001f3fae983af686267bcb122aa51763bf5b701",
    "workBranch": "work/operations/project-state-v2-migration"
  },
  "candidate": {
    "schemaVersion": "ProjectState 2.0",
    "project": {
      "id": "mobilipresenter",
      "repository": "EAKerber/MobiliPresenter"
    },
    "git": {
      "controlBranch": "main",
      "activeDevelopmentBranch": null,
      "protectedBranches": [
        "coordination/leases",
        "coordination/continuations",
        "renderer/fixed-view-realistic-v1",
        "architecture/technical-presentation-contract-v0.1",
        "planning/scope-and-documentation",
        "ui/style-guide-v0.1",
        "ui/promotional-detail-v0.2",
        "tmp/fh06-user-artifacts",
        "backup/netlify-v7.0-i5-2026-08-11",
        "archive/v7.0-i5-recovery",
        "archive/legacy-fixed-view-variants-2026-08-11"
      ]
    },
    "published": {
      "url": "https://mobilipresenter.netlify.app/",
      "artifactManifest": "ops/published/viewer-next-current.json"
    },
    "development": {
      "initiative": "Viewer Next — Responsive Fixed-Frame",
      "phase": "between-increments",
      "checkpoint": "POST-GUIDED-CONFIGURATOR-0.3-INTEGRATED",
      "nextTransition": "open-developer-slice-for-responsive-fixed-frame-v0.1",
      "blockers": [],
      "prNumber": null
    }
  },
  "reversibility": "revertible",
  "planHash": "2b5f761d94e02c165cd5862f14d96bd09ef1c262e8e6251eaf3adc9a95f98ff1"
}
